"EmployerName","EmployerId","Address","PostCode","CompanyNumber","SicCodes","DiffMeanHourlyPercent","DiffMedianHourlyPercent","DiffMeanBonusPercent","DiffMedianBonusPercent","MaleBonusPercent","FemaleBonusPercent","MaleLowerQuartile","FemaleLowerQuartile","MaleLowerMiddleQuartile","FemaleLowerMiddleQuartile","MaleUpperMiddleQuartile","FemaleUpperMiddleQuartile","MaleTopQuartile","FemaleTopQuartile","CompanyLinkToGPGInfo","ResponsiblePerson","EmployerSize","CurrentName","SubmittedAfterTheDeadline","DueDate","DateSubmitted"
"CROSSROADS TRUCK & BUS LIMITED","3750","Crossroads Truck & Bus, Pheasant Drive, Birstall, Batley, West Yorkshire, WF17 9LR","WF17 9LR","00573068","45190,
45200,
45320","23.7","26.8","65.9","-62.3","58","71","65","35","73","27","97","3","94","6","https://www.dealer.volvotrucks.co.uk/crossroads/en-gb/tools/pay.html","Alex Stead (Group HR Manager)","250 to 499","CROSSROADS TRUCK & BUS LIMITED","False","2026/04/05 00:00:00","2026/01/14 15:02:25"
"CROUD INC LTD","22614","Cannon Place, 78 Cannon Street, London, England, EC4N 6AF","EC4N 6AF","07542498","70210","13.3","12.7","20.9","28","76.5","79.5","40.5","59.5","39.2","60.8","48.1","51.9","55.7","44.3","","Sophie Perks (Head of People Operations, EMEA)","250 to 499","CROUD INC LTD","False","2026/04/05 00:00:00","2025/11/04 17:23:18"
"CROWE U.K. LLP","16953","2nd Floor, 55 Ludgate Hill, London, United Kingdom, EC4M 7JW","EC4M 7JW","OC307043","","6.3","5.8","19.5","14.3","73.6","74.6","48.6","51.4","54.5","45.5","53.9","46.1","58.6","41.4","https://www.crowe.com/uk/about-us/gender-pay-report","Tony White (Partner, Chief People Officer)","1000 to 4999","CROWE U.K. LLP","False","2026/04/05 00:00:00","2025/12/19 15:53:08"
"CROWN PACKAGING MANUFACTURING UK LIMITED","3764","Crown Packaging Manufacturing Uk Limited Borland Avenue, Botcherby, Carlisle, Cumbria, CA1 2TL","CA1 2TL","10352429","25920","-18.93","4.74","-44.49","-241.14","87.69","69.14","82.39","17.61","94.92","5.08","95.48","4.52","83.05","16.95","","Sjoerd-Jaap Schaaf (VP Human Resouces Bevcan Europe)","500 to 999","CROWN PACKAGING MANUFACTURING UK LIMITED","False","2026/04/05 00:00:00","2026/01/14 14:44:17"
"CULTURE, LEARNING AND LIBRARIES (MIDLANDS)","15387","Inspire Headquarters, Glaisdale Parkway, Nottingham, NG8 4GP","NG8 4GP","RS007139","","7.2","9.6","","","0","0","20","80","22","78","26","74","32","68","","Peter Gaw (CEO)","500 to 999","CULTURE, LEARNING AND LIBRARIES (MIDLANDS)","False","2026/04/05 00:00:00","2025/11/28 15:35:05"
"Cumbria Fire and Rescue Service","22537","Fire and Rescue Service Headquarters, Kemplay Bank, Penrith, Cumbria, CA10 2FA","CA10 2FA","","","1.93","1.57","10.07","0.00","29.96","24.56","66.05","33.95","95.06","4.94","82.1","17.9","82.1","17.9","https://www.cumbriafire.gov.uk/sites/default/files/2025-12/3566-CFRS-Gender%20Pay%20Gap%20Summary%20Report-2025-12pp-A4-v3-DIGITAL%20%281%29.pdf","","500 to 999","Cumbria Fire and Rescue Service","False","2026/03/31 00:00:00","2025/12/01 15:10:40"
"CYNERGY BANK PLC","16858","4th Floor One New Change, London, England, EC4M 9AF","EC4M 9AF","04728421","64191","26","22","42.7","12.4","77.9","81.8","47.8","52.2","54.9","45.1","57.6","42.4","81.3","18.7","","Nick Fahy (Chief Executive)","250 to 499","CYNERGY BANK PLC","False","2026/04/05 00:00:00","2026/01/07 14:32:22"
"DAIKIN AIRCONDITIONING UK LIMITED","3870","The Heights, Brooklands, Weybridge, Surrey, KT13 0NY","KT13 0NY","04616794","35300","13.7","26","25.5","30","91.7","92.3","51.9","48.1","77.9","22.1","82.7","17.3","80.8","19.2","","Angela Holt (Head of HR)","250 to 499","DAIKIN AIRCONDITIONING UK LIMITED","False","2026/04/05 00:00:00","2025/12/23 13:32:55"
"DAINS ACCOUNTANTS LIMITED","24168","2 Chamberlain Square, Birmingham, United Kingdom, B3 3AX","B3 3AX","13775282","69201","26.09","20.32","61.07","0.00","76.26","85.35","45.83","54.17","33.33","66.67","47.22","52.78","63.89","36.11","https://www.dains.com/about/gender-pay-gap-report-april-2025","Angela Millward (HR Director)","250 to 499","DAINS ACCOUNTANTS LIMITED","False","2026/04/05 00:00:00","2025/12/15 12:00:17"
"DANBRO EMPLOYMENT UMBRELLA LTD","19080","Jubilee House, East Beach, Lytham St. Annes, United Kingdom, FY8 5FT","FY8 5FT","10585274","78200","6.57","0.0","35.02","52.15","98.84","99.03","82","18","83","17","86","14","84","16","https://www.danbro.co.uk/gender-pay-gap-statement-24/","Helen Broughton (CEO)","500 to 999","DANBRO EMPLOYMENT UMBRELLA LTD","False","2026/04/05 00:00:00","2025/05/28 06:44:35"
"DANIEL OWEN LTD","17494","Hadwyn House, Field Road, Reading, Berkshire, RG1 6AP","RG1 6AP","02142070","78200","22","16","15","37","8","26","61","39","68","32","87","13","76","24","https://www.danielowen.co.uk/candidates/gender-pay-gap-report/","Suzanne Jellyman (CFO)","500 to 999","DANIEL OWEN LTD","False","2026/04/05 00:00:00","2026/01/02 12:32:14"
"DANIEL THWAITES PUBLIC LIMITED COMPANY","421","Myerscough Road, Mellor Brook, Blackburn, Lancashire, England, BB2 7LB","BB2 7LB","00051702","11050,
55100,
56101,
56302","12.1","3.9","83.8","70.2","24.3","29.2","40.6","59.4","26.5","73.5","43.1","56.9","57.6","42.4","","Jason Royal (Director of People & Development)","1000 to 4999","DANIEL THWAITES PUBLIC LIMITED COMPANY","False","2026/04/05 00:00:00","2025/12/12 09:48:35"
"DATA TECH HOLDINGS LIMITED","20871","Unit 4, Gateway Business Centre, Tom Cribb Road, London, United Kingdom, SE28 0EZ","SE28 0EZ","11728816","64209","10","23","75.7","-600","28.8","77.3","76.5","23.5","84.7","15.3","96.5","3.5","90.5","9.5","","TIM COPPIN (CHIEF EXECUTIVE OFFICER)","250 to 499","DATA TECH HOLDINGS LIMITED","False","2026/04/05 00:00:00","2025/09/10 14:45:51"
"DAUNTSEY'S SCHOOL","3920","Dauntsey's School, West Lavington, Devizes, Wiltshire, SN10 4HE","SN10 4HE","05872694","85310","17.9","30.8","35","50","2.1","1.6","31.6","68.4","29.3","70.7","34.3","65.7","50","50","https://resources.finalsite.net/images/v1765374333/dauntseysorg/lptfhcdolkgb5fn8bjnk/GenderPayGapreportApril2025.pdf","Rosanna Brodie (Head of Finance)","250 to 499","DAUNTSEY'S SCHOOL","False","2026/04/05 00:00:00","2025/12/10 13:54:08"
"DD PRODUCTS AND SERVICES LTD","2070","6 Perry Way, Witham, England, CM8 3SX","CM8 3SX","01196676","46900","4.6","10.4","-63.9","32.0","86","89","50","50","53","47","64","36","59","41","","Samantha Tyrer (CEO)","250 to 499","DD PRODUCTS AND SERVICES LTD","False","2026/04/05 00:00:00","2025/12/29 13:22:47"
"DECIDEBLOOM LIMITED","119","Stoneacre Omega Boulevard, Thorne, Doncaster, South Yorkshire, England, DN8 5TX","DN8 5TX","03003995","45111,
45112,
45200,
45320","27","13","83","93","84","23","71","29","64","36","81","19","89","11","","Sarah Waddington (Head of HR & Compliance)","1000 to 4999","DECIDEBLOOM LIMITED","False","2026/04/05 00:00:00","2025/05/13 12:52:13"
"DELIFRANCE (UK) LIMITED","3994","17 Chartwell Drive, Wigston, Leicestershire, LE18 2FL","LE18 2FL","02186392","10710,
46390","10","5","20.3","6.3","86.4","84.4","57","43","70","30","72","28","70","30","https://www.delifrance.com/uk/gender-pay-gap-statement","Niall Cogan (General Manager)","250 to 499","DELIFRANCE (UK) LIMITED","False","2026/04/05 00:00:00","2026/01/02 08:50:01"
"DELOITTE LLP","399","1 New Street Square, London, United Kingdom, EC4A 3HQ","EC4A 3HQ","OC303675","","11.0","10.4","40.8","25.4","83.1","85.7","52.3","47.7","44.5","55.5","51.0","49.0","57.2","42.8","https://www.deloitte.com/uk/en/about/governance/annual-review-2025/sharing-our-pay-gap.html","Philip Mills (UK Managing Partner)","5000 to 19,999","DELOITTE LLP","False","2026/04/05 00:00:00","2025/09/30 14:09:42"
"DELOITTE MCS LIMITED","400","1 New Street Square, London, United Kingdom, EC4A 3HQ","EC4A 3HQ","03311052","69201,
70229,
82990","12.4","12.2","45.6","37.9","93","93.3","49.9","50.1","54.7","45.3","61","39","67.2","32.8","https://www.deloitte.com/uk/en/about/governance/annual-review-2025/sharing-our-pay-gap.html","Philip Mills (UK Managing Partner)","5000 to 19,999","DELOITTE MCS LIMITED","False","2026/04/05 00:00:00","2025/09/30 14:24:27"
"DEMATIC LIMITED","4007","Banbury Business Park Trinity Way, Adderbury, Banbury, Oxfordshire, OX17 3SN","OX17 3SN","05856366","28990,
30990,
33200,
71129","0.91","2.21","-37.13","-890.67","92.75","98.88","81.44","18.56","91.62","8.38","87.43","12.57","86.23","13.77","https://www.dematic.com/en-gb/about/careers/","Jade Rawson (HR Business Partner)","500 to 999","DEMATIC LIMITED","False","2026/04/05 00:00:00","2025/12/02 09:19:41"
"Department for Business and Trade","22631","Old Admiralty Building, Admiralty Place, London, United Kingdom, SW1A 2DY","SW1A 2DY","","","4.67","7.39","-0.52","-0.79","83.23","81.91","44.4","55.6","51.5","48.5","51.7","48.3","54.3","45.7","https://www.gov.uk/government/publications/dbt-gender-pay-gap-report-and-data-2025","","1000 to 4999","Department for Business and Trade","False","2026/03/31 00:00:00","2025/12/16 16:00:07"
"Department for Culture, Media and Sport","4030","100 Parliament Street, London, London, SW1A 2BQ","SW1A 2BQ","","1,
84110","2.6","5.2","3.8","0","86.4","83","38.3","61.7","39.2","60.8","40.9","59.1","42.2","57.8","https://www.gov.uk/government/publications/dcms-gender-pay-gap-report-2025","","1000 to 4999","Department for Culture, Media and Sport","False","2026/03/31 00:00:00","2025/12/17 13:04:29"
"Department for Education","234","Great Smith Street, London, London, United Kingdom, SW1P 3BT","SW1P 3BT","","1,
84110","4.2","6.7","-2.3","-5.6","97.1","96.9","36.3","63.7","37.9","62.1","42.4","57.6","44.6","55.4","https://www.gov.uk/government/publications/department-for-education-gender-pay-gap-2025","","5000 to 19,999","Department for Education","False","2026/03/31 00:00:00","2025/12/16 16:03:16"
"Department for Energy Security and Net Zero","23516","55 Whitehall, London, SW1A 2HP","SW1A 2HP","","","4.0","7.9","7.7","0.0","87.4","84.6","45.9","54.1","46.5","53.5","53.0","47.0","53.2","46.8","https://www.gov.uk/government/publications/desnz-gender-pay-gap-report-and-data-2025","","1000 to 4999","Department for Energy Security and Net Zero","False","2026/03/31 00:00:00","2025/12/16 16:03:23"
"Department for Environment, Food and Rural Affairs","14454","Nobel House, 17 Smith aquare, London, SW1P 3JR","SW1P 3JR","","1,
84110","4.3","7.1","-2.4","-4.0","86.3","87.4","39.7","60.3","41.4","58.6","44.3","55.7","48","52","https://www.gov.uk/government/publications/defra-gender-pay-gap-report-2025","","5000 to 19,999","Department for Environment, Food and Rural Affairs","False","2026/03/31 00:00:00","2025/12/16 16:01:21"
"Department for Science, Innovation and Technology","23517","22-26 Whitehall, London, SW1A 2EG","SW1A 2EG","","","2.3","1.1","-7.9","-8.8","83","81.1","45.9","54.1","47.8","52.2","51.5","48.5","48.3","51.7","https://www.gov.uk/government/publications/dsit-gender-pay-gap-report-and-data-2025","","1000 to 4999","Department for Science, Innovation and Technology","False","2026/03/31 00:00:00","2026/01/06 15:58:45"
"Department For Transport","4034","Great Minster House, 76 Marsham Street, London, London, United Kingdom, SW1P 4DR","SW1P 4DR","","1,
84110","6.2","6.6","-10.2","-12.9","88.8","92","47","53","54","46","56","44","60","40","https://www.gov.uk/government/publications/dft-gender-pay-gap-report-and-data-2025","","5000 to 19,999","Department For Transport","False","2026/03/31 00:00:00","2025/12/16 16:09:32"
"Department for Work And Pensions","4036","Caxton House, 6-12 Tothill Street, London, London, United Kingdom, SW1H 9NA","SW1H 9NA","","1,
84110","4.2","0.0","6.3","1.8","91.5","93.4","35.3","64.7","36.9","63.1","36.8","63.2","41.4","58.6","https://www.gov.uk/government/publications/dwp-gender-pay-gap-report-and-data-for-2025","","20,000 or more","Department for Work And Pensions","False","2026/03/31 00:00:00","2025/12/16 15:49:23"
"DEVOL KITCHENS LIMITED","23654","Cotes Mill Nottingham Road, Cotes, Loughborough, Leicestershire, LE12 5TL","LE12 5TL","06707961","31020","-4.82","0.60","","","0","0","74","26","65","35","65","35","66","34","","Robin Chappell (Finance Director)","250 to 499","DEVOL KITCHENS LIMITED","False","2026/04/05 00:00:00","2026/01/02 13:17:08"
"Devon County Council","4070","County Hall, Topsham Road, Exeter, Devon, United Kingdom, EX2 4QD","EX2 4QD","","1,
84110","6.56","9.11","","","0","0","20.5","79.5","22.1","77.9","29.2","70.8","31.9","68.1","https://www.devon.gov.uk/facts-and-figures/the-council-staffing-and-pay/gender-pay-gap-report-december-2025-based-on-data-to-31-march-2025/","","5000 to 19,999","Devon County Council","False","2026/03/31 00:00:00","2025/12/23 14:53:19"
"Devon Partnership Nhs Trust","4073","Dryden Road, Exeter, Devon, United Kingdom, EX2 5AF","EX2 5AF","","1,
86210","10.6","5.25","26.3","58.3","1.8","0.17","24.01","75.99","25.34","74.66","22.57","77.43","32.03","67.97","","","1000 to 4999","Devon Partnership Nhs Trust","False","2026/03/31 00:00:00","2025/09/22 10:27:53"
"DHAMECHA FOODS LIMITED","4091","2 Hathaway Close, Stanmore, Middlesex, HA7 3NR","HA7 3NR","01163739","46342,
46390","-0.4","0","35","11","72","28","79","21","80","20","78","22","81","19","https://www.dhamecha.com/group","FAYAAZ SHARIFF (Finance Director)","500 to 999","DHAMECHA FOODS LIMITED","False","2026/04/05 00:00:00","2025/08/27 16:08:09"
"DHL AVIATION (UK) LIMITED","4094","Southern Hub, Unit 1, Horton Road, Colnbrook, Berkshire, England, SL3 0BB","SL3 0BB","02096375","51102,
52242","-1.75","1.61","-5.9","-8.7","93.73","96.38","77.74","22.26","63.72","36.28","74.28","25.72","78.08","21.92","","Felicia Azzolina (Compensation and Benefits Sr Manager)","1000 to 4999","DHL AVIATION (UK) LIMITED","False","2026/04/05 00:00:00","2026/01/06 13:31:11"
"DIOCESE OF SOUTHWELL AND NOTTINGHAM MULTI-ACADEMY TRUST","14521","Jubilee House, Westgate, Southwell, Nottinghamshire, NG25 0JH","NG25 0JH","08738949","85590","21.18","22.9","","","0","0","10.29","89.71","14.75","85.25","18.03","81.97","25.10","74.90","","","500 to 999","DIOCESE OF SOUTHWELL AND NOTTINGHAM MULTI-ACADEMY TRUST","False","2026/03/31 00:00:00","2026/01/05 13:11:36"
"DIRECT TABLE FOODS LIMITED","4142","Saxham Business Park, Little Saxham, Bury St Edmunds, Suffolk, IP28 6RX","IP28 6RX","01816960","10110","18.8","8.9","","","0","0","50","50","45","55","53","47","79","21","","Neil Taylor (Managing Director)","250 to 499","DIRECT TABLE FOODS LIMITED","False","2026/04/05 00:00:00","2025/10/22 08:25:37"
"DISCOVERY EDUCATIONAL TRUST","2353","St Martin's School Brentwood Hanging Hill Lane, Hutton, Brentwood, Essex, CM13 2HG","CM13 2HG","07638800","85590","19.08","36.38","","","0","0","18.12","81.88","14.39","85.61","26.81","73.19","35.25","64.75","https://www.discoveryeducationaltrust.co.uk/assets/Documents/Finance-and-Funding/DET-Gender-Pay-Gap-Report-as-at-31-Mar-24-Final-Approved-Nov-24.pdf","","500 to 999","DISCOVERY EDUCATIONAL TRUST","False","2026/03/31 00:00:00","2025/11/28 08:35:56"
"DOLBY MEDICAL HOME RESPIRATORY CARE LIMITED","20278","North Suite Lomond Court, Castle Business Park, Stirling, Scotland, FK9 4TU","FK9 4TU","SC063902","86900","-5","4","-17","40","8","18","77","23","45","55","71","29","62","38","","Jane Normann (HR Director)","250 to 499","DOLBY MEDICAL HOME RESPIRATORY CARE LIMITED","False","2026/04/05 00:00:00","2026/01/05 12:26:53"
"DORNAN ENGINEERING SERVICES LIMITED","4212","2nd Floor Emperor's Gate, 114a Cromwell Road, London, England, SW7 4ES","SW7 4ES","05799522","71129","37.81","35.88","61.26","37.22","74.86","78.79","70.87","29.13","82.52","17.48","91.26","8.74","93.14","6.86","https://www.dornan.ie/gender-pay-gap-report/","Niamh McAuliffe (Group HR Director)","250 to 499","DORNAN ENGINEERING SERVICES LIMITED","False","2026/04/05 00:00:00","2025/09/25 08:37:50"
"Dorset & Wiltshire Fire & Rescue Service","14308","Five Rivers Health & Wellbeing Centre, Hulse Road, Salisbury, SP1 3NR","SP1 3NR","","1,
84250","8.5","9.43","","","0","0","65.9","34.1","82.3","17.7","88.2","11.8","84.5","15.5","","","1000 to 4999","Dorset & Wiltshire Fire & Rescue Service","False","2026/03/31 00:00:00","2025/11/19 16:49:52"
"DOUGLAS MACMILLAN HOSPICE","4224","Barlaston Road, Blurton, Stoke On Trent, Staffordshire, ST3 3NZ","ST3 3NZ","03615904","86101,
86220,
86900","-5.5","-6.00","","","0","0","17.60","82.40","11.80","88.20","14.30","85.70","5.90","94.10","","David Webster (Chief Executive)","250 to 499","DOUGLAS MACMILLAN HOSPICE","False","2026/04/05 00:00:00","2025/11/18 13:54:51"
"DOW JONES INTERNATIONAL LTD.","4232","The News Building 7th Floor, 1 London Bridge Street, London, United Kingdom, SE1 9GF","SE1 9GF","01164588","82990","17.4","20.3","30.7","45.3","55.4","51.2","30","70","48","52","56","44","58","42","https://www.dowjones.com/gender-pay-gap-report/","Dianne DeSevo (Chief People Officer)","250 to 499","DOW JONES INTERNATIONAL LTD.","False","2026/04/05 00:00:00","2026/01/13 22:01:46"
"DRIVE DEVILBISS HEALTHCARE LIMITED","4268","Drive Devilbiss Healthcare Sidhil Business Park, Holmfield, Halifax, West Yorkshire, England, HX2 9TN","HX2 9TN","04301005","46900,
86900","0.07","7.12","51.29","26.24","18.45","31.94","68.35","31.65","74.10","25.9","85.61","14.39","68.35","31.65","","Simon Adams (Finance Director)","500 to 999","DRIVE DEVILBISS HEALTHCARE LIMITED","False","2026/04/05 00:00:00","2025/12/09 15:27:37"
"DUDLEY ACADEMIES TRUST","18893","The Drawbridge Unit 2, Castle Court, Castlegate Way, Dudley, West Midlands, England, DY1 4RD","DY1 4RD","10897797","85600","17.9","42.8","","","0","0","5.03","94.97","21.87","78.13","26.25","73.75","34.37","65.63","https://api.intralink.cloud/every/versioned-policy-loader.php?policy=https://www.every.education//Open/CentralDocuments?pgk=103&categoryKey=38161","","500 to 999","DUDLEY ACADEMIES TRUST","False","2026/03/31 00:00:00","2025/12/07 22:05:55"
"DUDLEY BOROUGH COLLEGE LIMITED","17166","Dudley College Of Technology, The Broadway, Dudley, England, DY1 4AS","DY1 4AS","08717981","85320","7","24","","","0","0","33","67","34","66","48","52","64","36","https://www.dudleycol.ac.uk","Kathryn Jones (HR Director)","500 to 999","DUDLEY BOROUGH COLLEGE LIMITED","False","2026/04/05 00:00:00","2025/12/15 12:10:07"
"Duke of Northumberland The Northumberland Estates","17752","Estate Office, Alnwick Castle, Alnwick, NE66 1NQ","NE66 1NQ","","68209","21.93","0.96","-7.39","0","8.43","6.81","51.38","48.62","52.29","47.71","47.27","52.73","60","40","","Clare Ingle (CFO)","250 to 499","Duke of Northumberland The Northumberland Estates","False","2026/04/05 00:00:00","2025/12/12 11:45:45"
"Durham and Newcastle Diocesan Learning Trust","22766","Cai Building 4th Floor, Coble Dene, Royal Quays, NORTH SHIELDS, United Kingdom, NE29 6DE","NE29 6DE","","","22.04","34.18","","","0","0","4.1","95.9","10.66","89.34","11.48","88.52","18.85","81.15","https://site-durham-newcastle-diocesan-learning-trust.s3.amazonaws.com/media/Statutory%20information/gender-pay-gap-reporting-statement-1.pdf","","250 to 499","Durham and Newcastle Diocesan Learning Trust","False","2026/03/31 00:00:00","2025/12/17 16:00:34"
"Dyfed Powys Police","4338","PO Box 99, Llangunnor, Carmarthen, SA31 2PF","SA31 2PF","","1,
84240","8.89","16.79","","","0","0","46.3","53.7","43.6","56.4","54.3","45.7","63.7","36.3","https://www.dyfed-powys.police.uk/police-forces/dyfed-powys-police/areas/about-us/about-us/gender-pay-gap/","","1000 to 4999","Dyfed Powys Police","False","2026/03/31 00:00:00","2026/01/14 13:56:08"
"DYNEX SEMICONDUCTOR LIMITED","4341","Doddington Road, Lincoln, Lincolnshire, LN6 3LF","LN6 3LF","03824626","26110","22.9","22.4","47.13","0","58.76","41.24","52.78","47.22","59.15","40.85","87.32","12.68","85.92","14.08","","Su Bailey (Chief HR Officer)","250 to 499","DYNEX SEMICONDUCTOR LIMITED","False","2026/04/05 00:00:00","2026/01/08 13:06:36"
"E H SMITH (BUILDERS MERCHANTS) LIMITED","4351","Westhaven House, Arleston Way, Shirley, Solihull, West Midlands, B90 4LH","B90 4LH","00800907","46130,
46730,
47520","10","1","80","0","31","10","82","18","77","23","84","16","79","21","","Ian Grainger (Finance Director)","250 to 499","E H SMITH (BUILDERS MERCHANTS) LIMITED","False","2026/04/05 00:00:00","2025/05/09 10:16:39"
"E.E. SMITH CONTRACTS LIMITED","18897","25 Morris Road, Clarendon Industrial Estate, Leicester, LE2 6AL","LE2 6AL","00534798","31090,
43320,
43999","11.38","13.02","76.41","-60.00","62.24","55.00","87.04","12.96","87.04","12.96","96.30","3.70","92.59","7.41","","Neil Simpson (Director)","Less than 250","E.E. SMITH CONTRACTS LIMITED","False","2026/04/05 00:00:00","2025/11/10 16:02:05"
"EAST ANGLIA'S CHILDREN'S HOSPICES","15631","East Anglia's Children's Hospice, Milton Church Lane, Milton, Cambridge, Cambridgeshire, England, CB24 6AB","CB24 6AB","03550187","86900","0.1","-6.4","","","0","0","21.9","78.1","22.4","77.6","10.4","89.6","13.1","86.9","https://www.each.org.uk/app/uploads/2025/09/gender-pay-report-April-2025.pdf","Amanda Drummond (Head of HR)","250 to 499","EAST ANGLIA'S CHILDREN'S HOSPICES","False","2026/04/05 00:00:00","2025/09/25 16:46:12"
"East Devon District Council","4384","Blackdown House, Border Road, Heathpark Industrial Estate, Honiton, United Kingdom, EX14 1EJ","EX14 1EJ","","1,
84110","1.57","-7.92","","","0","0","61","39","36","64","34","66","58","42","","","500 to 999","East Devon District Council","False","2026/03/31 00:00:00","2025/06/03 12:18:27"
"East Dunbartonshire Council","19209","Southbank Marina, 12 Strathkelvin Place, Kirkintilloch, G66 1TJ","G66 1TJ","","1","3.03","0","","","0","0","14","86","31","69","23","77","27","73","https://www.eastdunbarton.gov.uk/about/our-council/governance/gender-pay-gap/","","5000 to 19,999","East Dunbartonshire Council","False","2026/03/31 00:00:00","2026/01/09 12:03:57"
"East Midlands Ambulance Service NHS Trust","4399","1 Horizon Place, Mellors Way,, Nottingham, NG8 6PY","NG8 6PY","","1,
86210","5.88","6.8","","","0","0","41.61","58.39","41.60","58.40","43.23","56.77","54.55","45.45","","","1000 to 4999","East Midlands Ambulance Service NHS Trust","False","2026/03/31 00:00:00","2025/12/16 11:22:09"
"EAST OF ENGLAND CO-OPERATIVE SOCIETY LIMITED","394","Wherstead Park, The Street, Wherstead, Ipswich, Suffolk, United Kingdom, IP9 2BJ","IP9 2BJ","IP01099R","","16.82","3.53","","","0","0","28.2","71.8","27.3","72.7","33.2","66.8","52.5","47.5","","Jordan Holder (Head of Talent & Culture)","1000 to 4999","EAST OF ENGLAND CO-OPERATIVE SOCIETY LIMITED","False","2026/04/05 00:00:00","2025/10/14 08:02:58"
"EAST PARK SCHOOL","21503","1092 Maryhill Road, Glasgow, G20 9TD","G20 9TD","SC356976","85590","1.9","0","","","0","0","37","63","15","85","41","59","30","70","https://www.eastpark.org.uk/gender-pay-gap/","Cheryl Gallagher (Finance Manager)","250 to 499","EAST PARK SCHOOL","False","2026/04/05 00:00:00","2025/12/18 15:35:35"
"East Renfrewshire Council","19920","Eastwood Park, Rouken Glen Road, Giffnock, East Renfrewshire, G46 6UG","G46 6UG","","","5.8","21.3","","","0","0","18","82","23","77","31","69","22","78","","","1000 to 4999","East Renfrewshire Council","False","2026/03/31 00:00:00","2026/01/13 14:23:34"
"East Sussex College Group","20406","Cross Levels Way, Eastbourne, East Sussex, BN21 2UF","BN21 2UF","","","9.1","16.9","-25.2","0","1.26","0.13","27.3","72.7","26.7","73.3","40.4","59.6","41.2","58.8","https://eastsussexcollegegroup.sharepoint.com/:b:/r/sites/ESCGIntranet/LM%20Documents/Gender%20Pay%20Gap%20Annual%20Report%202024-25.pdf?csf=1&web=1&e=hBFxdP","","1000 to 4999","East Sussex College Group","False","2026/03/31 00:00:00","2026/01/13 13:22:16"
"East Sussex Healthcare NHS Trust","15871","Conquest Hospital, The Ridge, St Leonards-on-Sea, TN37 7RD","TN37 7RD","","1,
86101","19.2","5.0","22.1","6.9","2.3","0.2","22.3","77.7","25.5","74.5","18.9","81.1","32.6","67.4","https://www.esht.nhs.uk/about-us/equality-inclusion-and-human-rights/","","5000 to 19,999","East Sussex Healthcare NHS Trust","False","2026/03/31 00:00:00","2025/09/18 10:39:30"
"EAST YORKSHIRE MOTOR SERVICES LIMITED","4417","Second Floor 55 Degrees North, Pilgrim Street, Newcastle Upon Tyne, United Kingdom, NE1 6BL","NE1 6BL","00216628","49319","7.49","-0.27","100","100","0.74","0","84.62","15.38","92.25","7.75","80.99","19.01","93.66","6.34","","Gordon Bell (Financial Director)","500 to 999","EAST YORKSHIRE MOTOR SERVICES LIMITED","False","2026/04/05 00:00:00","2025/12/04 10:25:37"
"EASTERN HOLDINGS LIMITED","28","8 Westerton Road, East Mains Industrial Estate, Broxburn, West Lothian, Scotland, EH52 5AU","EH52 5AU","SC014833","70100","27.7","21.6","61.4","61.2","74.0","70.3","65.9","34.1","61.0","39.0","86.2","13.8","88.9","11.1","https://www.easternwestern.co.uk/","Nasser Mohammed (Group Financial Director)","1000 to 4999","EASTERN HOLDINGS LIMITED","False","2026/04/05 00:00:00","2025/08/28 13:40:44"
"EATON ELECTRIC LIMITED","4435","252 Bath Road, Slough, Berkshire, England, SL1 4DX","SL1 4DX","04617032","27900","28.1","29.3","17.2","21.9","58.7","52.2","62","38","71.1","28.9","75.2","24.8","77.5","22.5","https://www.eaton.com/content/dam/eaton/company/sustainability/files/eaton-uk-gender-pay-gap-report-2025.pdf","Michelle Gee (UK & Ireland HR Cluster Leader)","250 to 499","EATON ELECTRIC LIMITED","False","2026/04/05 00:00:00","2026/01/12 11:17:19"
"EATON LIMITED","4437","252 Bath Road, Slough, Berkshire, England, SL1 4DX","SL1 4DX","00155621","25620,
26511,
28131,
46900","-4.6","-5.6","2.6","5.2","35","47.8","82.2","17.8","84.3","15.7","85.8","14.2","76.9","23.1","https://www.eaton.com/content/dam/eaton/company/sustainability/files/eaton-uk-gender-pay-gap-report-2025.pdf","Michelle Gee (UK & Ireland HR Cluster Leader)","1000 to 4999","EATON LIMITED","False","2026/04/05 00:00:00","2026/01/12 11:14:41"
