"EmployerName","EmployerId","Address","PostCode","CompanyNumber","SicCodes","DiffMeanHourlyPercent","DiffMedianHourlyPercent","DiffMeanBonusPercent","DiffMedianBonusPercent","MaleBonusPercent","FemaleBonusPercent","MaleLowerQuartile","FemaleLowerQuartile","MaleLowerMiddleQuartile","FemaleLowerMiddleQuartile","MaleUpperMiddleQuartile","FemaleUpperMiddleQuartile","MaleTopQuartile","FemaleTopQuartile","CompanyLinkToGPGInfo","ResponsiblePerson","EmployerSize","CurrentName","SubmittedAfterTheDeadline","DueDate","DateSubmitted"
"London Fire Brigade","7804","169 Union Street, London, London, SE1 0LL","SE1 0LL","","1,
84110,
84250","-5.57","-1.39","","","0","0","74.76","25.24","89.94","10.06","86.95","13.05","71.99","28.01","https://www.london-fire.gov.uk/about-us/diversity-and-inclusion/accountability-and-transparency/","","5000 to 19,999","London Fire Brigade","False","2026/03/31 00:00:00","2025/12/15 08:58:57"
"LORDS GROUP TRADING PLC","21475","Second Floor, 12-15 Hanger Green, London, United Kingdom, W5 3EL","W5 3EL","11633708","70100","5.32","5.69","1.19","-3.52","77.5","78.2","89.61","10.39","81.82","18.18","81.36","18.64","80","20","https://www.lordsgrouptradingplc.co.uk/about-us/gender-pay-gap-report","Anne Prince (Group HR Director)","500 to 999","LORDS GROUP TRADING PLC","False","2026/04/05 00:00:00","2025/09/09 15:05:38"
"LOVEHONEY LIMITED","20300","100 Locksbrook Road, Bath, BA1 3EN","BA1 3EN","04637868","47990","-13.1","4.2","43.1","20","68.6","77.5","54.5","45.5","34.8","65.2","37.9","62.1","56.9","43.1","","Chloe Currie (People Systems & Data Analyst)","250 to 499","LOVEHONEY LIMITED","False","2026/04/05 00:00:00","2025/05/23 15:28:01"
"LOWELL FINANCIAL LTD","7878","No. 1 The Square Thorpe Park View, Thorpe Park, Leeds, England, LS15 8GH","LS15 8GH","04558936","82911","6.83","2.57","25.41","14.70","97.6","97.8","43.5","56.5","50","50","54.3","45.7","56.5","43.5","","Jen Allison (Group People Director)","500 to 999","LOWELL FINANCIAL LTD","False","2026/04/05 00:00:00","2025/12/17 14:06:55"
"LOWELL UK SHARED SERVICES LIMITED","20423","No. 1 The Square Thorpe Park View, Thorpe Park, Leeds, England, LS15 8GH","LS15 8GH","08336897","64205","14.57","13.30","26.16","24.23","95.9","98.6","33.8","66.2","54.9","45.1","54.9","45.1","59.2","40.8","","Jen Allison (Group People Director)","250 to 499","LOWELL UK SHARED SERVICES LIMITED","False","2026/04/05 00:00:00","2025/12/17 14:11:50"
"LTA SERVICES LIMITED","7887","The Lawn Tennis Association, 100 Priory Lane, Roehampton, London, SW15 5JQ","SW15 5JQ","03260051","78300","21.7","11.4","36.7","11.1","94","92","51","49","48","52","55","45","65","35","https://www.lta.org.uk/4a79f2/siteassets/about-lta/file/lta-2025-gender-pay-gap-report.pdf","Victoria Williams (People Director)","250 to 499","LTA SERVICES LIMITED","False","2026/04/05 00:00:00","2025/10/01 08:19:09"
"LUCID GROUP COMMUNICATIONS LIMITED","22154","Sea Containers House 6th Floor, 22 Upper Ground, London, England, SE1 9PD","SE1 9PD","09212331","70210","6.44","11.73","68.42","-14.97","28.42","71.58","21.54","78.46","26.39","73.61","30.88","69.12","30","70","","Luke Devlin (Group Data & Systems Manager)","250 to 499","LUCID GROUP COMMUNICATIONS LIMITED","False","2026/04/05 00:00:00","2025/05/19 10:19:37"
"LUMEN CHRISTI CATHOLIC MULTI ACADEMY COMPANY","7901","St Thomas Aquinas Catholic School, Wychall Lane, Birmingham, B38 8AP","B38 8AP","09471525","85100,
85200,
85310","20.92","29.15","","","0","0","12.4","87.6","10.7","89.3","13.6","86.4","27.2","72.8","","","250 to 499","LUMEN CHRISTI CATHOLIC MULTI ACADEMY COMPANY","False","2026/03/31 00:00:00","2026/01/06 08:35:12"
"Luminate Education Group","7527","Park Lane, Leeds, West Yorkshire, United Kingdom, LS3 1AA","LS3 1AA","","1,
85320","4.79","0.0","","","0","0","28.3","71.7","37.1","62.9","36.1","63.9","40.9","59.1","","","1000 to 4999","Luminate Education Group","False","2026/03/31 00:00:00","2026/01/05 10:22:11"
"M.MARKOVITZ LIMITED","21205","Commercial Road, Tideswell, Buxton, Derbyshire, England, SK17 8NY","SK17 8NY","00627513","46130","-11.2","-16.9","-31.3","-191.70","0.9","6.5","86.7","13.3","94.4","5.6","78.9","21.1","80.9","19.1","","lorraine Caddy (Finance Director)","250 to 499","M.MARKOVITZ LIMITED","False","2026/04/05 00:00:00","2026/01/05 16:26:25"
"M&Y MAINTENANCE & CONSTRUCTION LIMITED","15233","The Foundry, 42 Henry Street, Liverpool, England, L1 5AY","L1 5AY","03911918","43210,
43290,
43320","19.4","18.4","100","100","0.5","0","73.4","26.6","76.6","23.4","95.3","4.7","88.9","11.1","","Sean Rothwell (Director of People Services)","250 to 499","M&Y MAINTENANCE & CONSTRUCTION LIMITED","False","2026/04/05 00:00:00","2025/06/20 14:59:55"
"MACE CONSTRUCT LIMITED","21551","155 Moorgate, London, England, EC2M 6XB","EC2M 6XB","09887082","41100,
41201,
41202","31","33.4","","","0","0","50","50","77","23","84","16","92","8","https://www.macegroup.com/we-care/equality-diversity-and-inclusion/","Jason Millett (Group Chief Executive)","1000 to 4999","MACE CONSTRUCT LIMITED","False","2026/04/05 00:00:00","2025/11/13 16:42:11"
"MACE CONSULT LIMITED","21550","155 Moorgate, London, EC2M 6XB","EC2M 6XB","07094851","70229,
82990","17.1","16.2","","","0","0","49","51","60","40","70","30","75","25","https://www.macegroup.com/we-care/equality-diversity-and-inclusion/","Jason Millett (Group Chief Executive)","1000 to 4999","MACE CONSULT LIMITED","False","2026/04/05 00:00:00","2025/11/13 16:39:26"
"MACE LIMITED","7969","155 Moorgate, London, EC2M 6XB","EC2M 6XB","02410626","41100,
41201,
64203,
70229","14.3","12.8","","","0","0","29","71","42","58","42","58","56","44","https://www.macegroup.com/we-care/equality-diversity-and-inclusion/","Jason Millett (Group Chief Executive)","500 to 999","MACE LIMITED","False","2026/04/05 00:00:00","2025/11/13 16:36:15"
"MACINTYRE CARE","7978","Seebeck House 1 Seebeck Place, Knowlhill, Milton Keynes, England, MK5 8FR","MK5 8FR","00894054","85590,
87200,
87300,
87900","-3.28","0","","","0","0","33.12","66.88","31.82","68.18","29","71","22.94","77.06","","Gemma Scott (HR Advisor)","1000 to 4999","MACINTYRE CARE","False","2026/04/05 00:00:00","2025/11/04 16:48:38"
"MAGICARD LTD","22630","Waverley House Hampshire Road, Granby Industrial Estate, Weymouth, England, DT4 9XD","DT4 9XD","10124762","26200","35.80","39.62","-53.53","0","9.52","8","29.41","70.59","52.94","47.06","76.47","23.53","93.75","6.25","","Toby Adams (HRBP)","Less than 250","MAGICARD LTD","False","2026/04/05 00:00:00","2026/01/05 18:28:11"
"Malvern Hills District Council","19693","Council House, Avenue Road, Malvern, Worcestershire, WR14 3AF","WR14 3AF","","1","-3.73","0.00","","","0","0","68.7","31.3","31.7","68.3","46.03","53.97","44.44","55.56","","","250 to 499","Malvern Hills District Council","False","2026/03/31 00:00:00","2025/12/12 12:55:26"
"MAMA BEAR'S DAY NURSERY LTD","8035","1st Floor, 60-62 High Street, Hanham, Bristol, South Glos, BS15 3DR","BS15 3DR","04546256","88910","20.0","7.6","","","0","0","3.0","97.0","3.0","97.0","4.5","95.5","10.4","89.6","https://mamabear.co.uk/mama-bears-gender-pay-gap-report","Anthony Driffield (Director)","250 to 499","MAMA BEAR'S DAY NURSERY LTD","False","2026/04/05 00:00:00","2025/12/10 14:07:48"
"MANAGEMENT & TRAINING CORPORATION LIMITED","8700","6-9 Snow Hill, London, England, EC1A 2AY","EC1A 2AY","09284837","84230","6.4","0.0","44.2","-7.1","6.5","5.5","63.8","36.2","68.1","31.9","68.1","31.9","63.4","36.6","https://www.mtcgroup.org.uk/uploads/documents/Gender_Pay_Gap_Report_2025.pdf","Harry Porter (HR Director)","250 to 499","MANAGEMENT & TRAINING CORPORATION LIMITED","False","2026/04/05 00:00:00","2025/12/01 11:55:54"
"MARELLI AUTOMOTIVE SYSTEMS UK LIMITED","2700","Llethri Road, Llanelli, Dyfed, SA14 8HU","SA14 8HU","02147831","22290,
29320","-3.39","0","-10.81","-62.31","3.32","5.31","88.03","11.97","89.2","10.8","92.37","7.63","86.06","13.94","","Melissa Dixon (HR Manager)","1000 to 4999","MARELLI AUTOMOTIVE SYSTEMS UK LIMITED","False","2026/04/05 00:00:00","2025/08/14 10:56:49"
"MARIPOSA CARE GROUP LIMITED","19282","Scholes Mill Old Coach Road, Tansley, Matlock, Derbyshire, United Kingdom, DE4 5FY","DE4 5FY","10104381","87100","5.51","0","","","0","0","16.7","83.3","7.9","92.1","16.6","83.4","23.2","76.8","","Joanne Barry (Head of Finance (Internal))","500 to 999","MARIPOSA CARE GROUP LIMITED","False","2026/04/05 00:00:00","2025/09/01 07:23:03"
"MARSHALL LAND SYSTEMS LTD","20506","Control Building The Airport, Newmarket Road, Cambridge, England, CB5 8RX","CB5 8RX","02661432","29201","-6.6","-11.3","88.4","0","36","32","93","7","88","12","87","13","83","17","https://marshallgroup.com/en/legal/gender-pay-reporting","Zoe Brennan (Chief People Officer)","250 to 499","MARSHALL LAND SYSTEMS LTD","False","2026/04/05 00:00:00","2025/10/22 08:08:20"
"MARSHALL OF CAMBRIDGE AEROSPACE LIMITED","8142","Control Building The Airport, Newmarket Road, Cambridge, England, CB5 8RX","CB5 8RX","00245740","30300","-9.2","-3.1","-8.6","0","27","37","81","19","91","9","91","9","80","20","https://marshallgroup.com/en/legal/gender-pay-reporting","Zoe Brennan (Chief People Officer)","500 to 999","MARSHALL OF CAMBRIDGE AEROSPACE LIMITED","False","2026/04/05 00:00:00","2025/10/22 08:12:24"
"MC TRUCK & BUS LIMITED","40","Beddow Way, Aylesford, Maidstone, Kent, ME20 7BT","ME20 7BT","01241061","45190,
45200,
45320","24.8","23.6","74.3","17.8","36.4","53.3","66.1","33.9","85.5","14.5","96.8","3.2","93.5","6.5","https://mcgroupltd.co.uk/gender-pay-report/","Peter Booth (Director)","250 to 499","MC TRUCK & BUS LIMITED","False","2026/04/05 00:00:00","2026/01/16 14:56:47"
"MCCARTHY & STONE MANAGEMENT SERVICES LIMITED","8226","Fourth Floor, 100 Holdenhurst Road, Bournemouth, Dorset, BH8 8AQ","BH8 8AQ","07166051","68209,
68320","24.11","0.07","51.89","8.20","80.00","80.44","17.48","82.52","17.48","82.52","14.79","85.21","38.03","61.97","","Joan Buszewska (Chief People & Information Officer)","500 to 999","MCCARTHY & STONE MANAGEMENT SERVICES LIMITED","False","2026/04/05 00:00:00","2025/10/01 14:27:26"
"MCCARTHY & STONE RETIREMENT LIFESTYLES LIMITED","8228","Fourth Floor, 100 Holdenhurst Road, Bournemouth, Dorset, BH8 8AQ","BH8 8AQ","06622231","41100,
68100","32.34","43.18","44.7","84.2","86.30","49.18","39","61","43","57","55","45","81","19","","Joan Buszewska (Chief People & Information Officer)","250 to 499","MCCARTHY & STONE RETIREMENT LIFESTYLES LIMITED","False","2026/04/05 00:00:00","2025/10/01 14:30:09"
"MCCURRACH UK LTD.","8234","Level 3, 6 St Andrew Square, Edinburgh, Scotland, EH2 2BD","EH2 2BD","SC039724","82990","-6","-3","-7","2","78","71","75","25","78","22","75","25","70","30","","Jennifer Kelly (HR Shared Service Administrator)","500 to 999","MCCURRACH UK LTD.","False","2026/04/05 00:00:00","2025/06/12 15:00:09"
"MEDICAL SERVICES INTERNATIONAL LIMITED","8292","Cromwell Hospital, Cromwell Road, London, SW5 0TU","SW5 0TU","01416977","86102,
86210,
86900","5.3","-2.1","10.4","-6.5","73.5","74.5","40.1","59.9","28.5","71.5","28.2","71.8","37.7","62.3","https://www.bupa.com/important-notices/pay-gap-reports","Carlos Jaureguizar (CEO, Bupa Global & UK)","500 to 999","MEDICAL SERVICES INTERNATIONAL LIMITED","False","2026/04/05 00:00:00","2026/01/02 12:46:48"
"MEDIQ HEALTHCARE UK LIMITED","2559","Mediq House Arundel Avenue, Castle Donington, Derby, England, DE74 2HJ","DE74 2HJ","00062537","46900","10.38","-5.78","27.77","-33.93","57","61","55.06","44.94","55.56","44.44","55.56","44.44","55.96","44.04","https://cdn.sanity.io/files/y6qwtdq7/mediq-prd/4d906e89ea2e4a6a008f08024540ded5fa88ad0c.pdf","Charlotte Baker (Head of HR UK&I)","250 to 499","MEDIQ HEALTHCARE UK LIMITED","False","2026/04/05 00:00:00","2026/01/05 10:15:09"
"MEIYUME (UK) LIMITED","7603","Aintree Avenue, White Horse Business Park, Trowbridge, United Kingdom, BA14 0XB","BA14 0XB","00483352","20420","17.76","5.73","67.46","0","54.75","44.39","41.82","58.18","50.91","49.09","42.59","57.41","45.26","54.74","","Thierry Rabu (CEO)","250 to 499","MEIYUME (UK) LIMITED","False","2026/04/05 00:00:00","2025/06/06 11:55:10"
"MERCIA LEARNING TRUST","8344","79 Glen Road, Sheffield, South Yorkshire, England, S7 1RB","S7 1RB","08119703","85200,
85310","18.9","45","","","0","0","18","82","23","77","35","65","36","64","","","500 to 999","MERCIA LEARNING TRUST","False","2026/03/31 00:00:00","2025/10/16 07:43:26"
"Mersey & West Lancashire Teaching Hospitals NHS Trust","23582","Whiston Hospital, Warrington Road, Prescot, L35 5DR","L35 5DR","","","24.52","8.11","-2.18","3.24","3.7","0.3","18.8","81.2","19.6","80.4","16.3","83.7","30.5","69.5","https://www.merseywestlancs.nhs.uk/gender-pay-gap-reporting","","5000 to 19,999","Mersey & West Lancashire Teaching Hospitals NHS Trust","False","2026/03/31 00:00:00","2025/12/22 13:12:04"
"Merseyside Fire and Rescue Service","14088","Bridle Road, Bootle, Merseyside, L30 4YD","L30 4YD","","1,
84250","8.3","3.8","","","0","0","54.7","45.3","78","22","72.2","27.8","78","22","","","500 to 999","Merseyside Fire and Rescue Service","False","2026/03/31 00:00:00","2025/11/03 14:05:00"
"METHODIST HOMES","8380","Epworth House, Stuart Street, Derby, Derbyshire, DE1 2EQ","DE1 2EQ","04043124","87100","1.2","0.9","","","0","0","22.2","77.8","20.6","79.4","20.1","79.9","22.1","77.9","https://mha.org.uk/about-us/equality-diversity/gender","Anna Marshall-Day (Director of People and Communications)","5000 to 19,999","METHODIST HOMES","False","2026/04/05 00:00:00","2025/05/20 13:15:22"
"Metropolitan Police Service","8391","New Scotland Yard, Victoria Embankment, London, London, United Kingdom, SW1A 2JL","SW1A 2JL","","1,
84240","5.9","7.79","-93.13","-100","3.75","3.24","51.67","48.33","56.17","43.83","71.53","28.47","70.62","29.38","","","20,000 or more","Metropolitan Police Service","False","2026/03/31 00:00:00","2026/01/02 12:38:49"
"MEWBURN ELLIS LLP","21506","39th Floor, 8 Bishopsgate 39th Floor, 8 Bishopsgate, London, England, EC2N 4BQ","EC2N 4BQ","OC306749","","22.6","27.2","35.1","53.8","89","97.4","21.4","78.6","26.1","73.9","35.7","64.3","53.6","46.4","https://www.mewburn.com/gender-pay-gap","Robert Andrews (Partner, Patent Attorney, Chief Inclusion & Diversity Officer)","250 to 499","MEWBURN ELLIS LLP","False","2026/04/05 00:00:00","2025/08/07 13:24:19"
"MI HUB LIMITED","8738","3 Long Acre, Willow Farm Business Park, Castle Donington, Derbyshire, England, DE74 2UG","DE74 2UG","00454264","14120","15.2","4.8","17.8","6.3","10.3","6.0","51.3","48.7","19.6","80.4","28.8","71.2","47.8","52.2","","Hayley Brooks (Chief Executive Officer)","250 to 499","MI HUB LIMITED","False","2026/04/05 00:00:00","2025/08/07 07:46:25"
"Mid & West Wales Fire & Rescue Service","16587","Service Headquarters, Lime Grove Avenue, Carmarthen, SA31 1SP","SA31 1SP","","1,
84250","5.1","1.6","","","0","0","66","34","83.5","16.5","89.5","10.5","83.5","16.5","","","1000 to 4999","Mid & West Wales Fire & Rescue Service","False","2026/03/31 00:00:00","2026/01/15 12:53:47"
"Mid and South Essex NHS Foundation Trust","20298","Prittlewell Chase, Westcliff On Sea, Southend, Essex, SS0 0RY","SS0 0RY","","","24.1605","7.4648","32.15","0.00","9.93","1.32","37.51","62.49","18.42","81.58","22.75","77.25","20.96","79.04","https://www.mse.nhs.uk/trust-publications-and-reports","","5000 to 19,999","Mid and South Essex NHS Foundation Trust","False","2026/03/31 00:00:00","2026/01/14 11:22:35"
"Middlesbrough College","8436","Dock Street, Middlesbrough, Cleveland, United Kingdom, TS2 1AD","TS2 1AD","","1,
85320","7.2","12.8","50.3","73.3","1.1","2.2","28.7","71.3","37.5","62.5","42.1","57.9","50.1","49.9","https://www.mbro.ac.uk/about-us/governance/gender-pay-gap","","1000 to 4999","Middlesbrough College","False","2026/03/31 00:00:00","2025/04/15 09:41:39"
"MIDDLESEX LEARNING TRUST","18638","The Compton School, Summers Lane, London, N12 0QG","N12 0QG","07445586","85310","15.6","20.1","","","0","0","13.3","86.7","25.0","75.0","25.7","74.3","32.1","67.9","","","250 to 499","MIDDLESEX LEARNING TRUST","False","2026/03/31 00:00:00","2025/12/10 09:56:54"
"MIDLAND HEART LIMITED","8444","20 Bath Row, Birmingham, West Midlands, United Kingdom, B15 1LZ","B15 1LZ","IP30069R","","12.16","3.57","70.8","0","97","96","40","60","51","49","56","44","55","45","https://www.midlandheartgroup.org.uk/investor-hub/environmental-social-and-governance/","Baljinder Kang (Executive Director)","1000 to 4999","MIDLAND HEART LIMITED","False","2026/04/05 00:00:00","2026/01/13 09:39:09"
"MIDLAND METRO LIMITED","31598","16 Summer Lane, Birmingham, England, England, B19 3SD","B19 3SD","10932342","33170,
49100,
49311,
49390","-5.07","0","","","0","0","88.9","11.1","83.6","16.4","76.7","23.3","84.9","15.1","https://www.westmidlandsmetro.com/","Claire Scrimshire (Head of HR & OD)","250 to 499","MIDLAND METRO LIMITED","False","2026/04/05 00:00:00","2025/12/22 17:00:13"
"MIGRANT HELP","21428","128 City Road, London, England, EC1V 2NX","EC1V 2NX","04172880","88990","1","0","0.5","17.2","23","77","41","59","30","70","50","50","28","72","https://www.migranthelpuk.org/Handlers/Download.ashx?IDMF=19c26872-9e61-43fa-ba67-1d7ca5ecdb2c","Fiona Stephens (Director of People and Culture)","500 to 999","MIGRANT HELP","False","2026/04/05 00:00:00","2026/01/07 09:28:31"
"MILETA SPORTS LIMITED","12777","Spen Vale Mills, Station Lane, Heckmondwike, Yorkshire, WF16 0NQ","WF16 0NQ","01132951","47710","12.5","1.3","37.3","66","62","66.6","34.7","65.3","25","75","53.1","46.9","45.8","54.2","https://www.tog24.com/pages/company-information","Emma Woodcock (Head of HR)","Less than 250","MILETA SPORTS LIMITED","False","2026/04/05 00:00:00","2026/01/16 15:59:33"
"Milton Keynes  College","16550","Chaffron Way Campus, Leadenhall, Milton Keynes, MK6 5LP","MK6 5LP","","1,
85310","7.0","7.7","-83.6","-65.0","0.8","1.0","19.5","80.5","29.2","70.8","37.5","62.5","37.9","62.1","","","1000 to 4999","Milton Keynes  College","False","2026/03/31 00:00:00","2025/06/16 12:34:32"
"Milton Keynes University Hospital NHS Foundation Trust","8486","Standing Way, Eaglestone, Milton Keynes, MK6 5LD","MK6 5LD","","1,
86210","24.63","9.96","37.05","20.00","3.45","0.39","20.64","79.36","14.37","85.63","14.29","85.71","33.22","66.78","","","1000 to 4999","Milton Keynes University Hospital NHS Foundation Trust","False","2026/03/31 00:00:00","2025/07/31 09:27:39"
"Ministry Of Defence","8498","6-N-22, MOD Main Building, Whitehall, London, United Kingdom, SW1A 2 HB","SW1A 2 HB","","1,
84110","5.4","9.8","19.3","17.5","60","65","49.2","50.8","59.4","40.6","62.4","37.6","63","37","https://www.gov.uk/government/publications/mod-gender-pay-gap-reports-2025","","20,000 or more","Ministry Of Defence","False","2026/03/31 00:00:00","2025/12/16 16:03:00"
"Ministry of Housing, Communities and Local Government","14369","Fry Building, 2 Marsham St, London, SW1P 4DF","SW1P 4DF","","1,
84110","3.4","0.5","9.1","10","47","51","43.6","56.4","47.2","52.8","46.8","53.2","51.5","48.5","https://www.gov.uk/government/publications/mhclg-gender-pay-gap-report-and-data-2025","","1000 to 4999","Ministry of Housing, Communities and Local Government","False","2026/03/31 00:00:00","2025/12/16 16:03:03"
"Ministry of Justice","8499","102 Petty France, London, London, SW1H 9AJ","SW1H 9AJ","","1,
84110","6.1","8","-1.1","-15.4","46.6","59.8","31","69","42","58","52","48","44","56","https://www.gov.uk/government/publications/ministry-of-justice-gender-pay-gap-report-2025","","20,000 or more","Ministry of Justice","False","2026/03/31 00:00:00","2025/12/16 16:02:02"
"MISSION SYSTEMS WIMBORNE LIMITED","5078","Brook Road, Wimborne, Dorset, BH21 2BJ","BH21 2BJ","00293529","28990","10.9","8.2","28.3","15.9","96.9","98.1","83.8","16.2","74.5","25.5","82.4","17.6","89.5","10.5","https://www.eaton.com/content/dam/eaton/company/sustainability/files/eaton-uk-gender-pay-gap-report-2025.pdf","Michelle Gee (UK & Ireland HR Cluster Leader)","500 to 999","MISSION SYSTEMS WIMBORNE LIMITED","False","2026/04/05 00:00:00","2026/01/12 11:19:17"
"MITSUBISHI ELECTRIC AIR CONDITIONING SYSTEMS EUROPE LTD.","8546","Mitsubishi Electric Air Conditioning, Nettlehill Road, Houstoun Industrial Estate, Livingston, EH54 5EQ","EH54 5EQ","SC191805","27510,
28250","9.4","9.1","15","0.7","93.1","95.7","60.2","39.8","64","36","56.7","43.3","77.8","22.2","","Fiona Souter (Payroll Section Manager)","1000 to 4999","MITSUBISHI ELECTRIC AIR CONDITIONING SYSTEMS EUROPE LTD.","False","2026/04/05 00:00:00","2025/12/15 09:44:48"
"MOAT HOMES LIMITED","8568","Mariner House, Galleon Boulevard, Dartford, KENT, United Kingdom, DA2 6QE","DA2 6QE","IP17434R","","21.3","17.7","11","0","77","85","21","79","22","78","37","63","48","52","https://www.moat.co.uk/media/4qvpqz1z/our-april-2025-pay-gap-report-gender-and-ethnicity.pdf","Carrie McKenzie (Executive Director People and Culture)","500 to 999","MOAT HOMES LIMITED","False","2026/04/05 00:00:00","2025/12/02 10:00:24"
"MODUS CARE LIMITED","15411","Minton Place, Victoria Street, Windsor, England, SL4 1EG","SL4 1EG","03983561","86900","-0.7","0","","","0","0.9","33.9","66.1","45.7","54.3","42.5","57.5","34.1","65.9","https://www.salutemcareandeducation.co.uk/gender-pay-gap-reports/","Ben Jones (People Systems Manager)","500 to 999","MODUS CARE LIMITED","False","2026/04/05 00:00:00","2025/12/11 11:22:32"
"Monmouthshire Building Society","22567","John Frost Square, Newport, Gwent, UK, NP20 1PX","NP20 1PX","","64192","24","20.3","-32.8","-300","7.8","14","26.1","73.9","30.4","69.6","44.9","55.1","47.1","52.9","https://www.monbs.com/gender-pay-gap/","William Carroll (Chief Executive Officer)","250 to 499","Monmouthshire Building Society","False","2026/04/05 00:00:00","2025/08/20 10:27:06"
"MONY GROUP FINANCIAL LIMITED","8599","Mony Group House, St. David's Park, Ewloe, Deeside, United Kingdom, CH5 3UZ","CH5 3UZ","03157344","63990","13.1","16.8","20.6","0","95","91","41","59","53","47","62","38","69","31","https://www.monygroup.com/sustainability/social/diversity-equity-inclusion-and-belonging-deib/gender-and-ethnicity-pay-gap-report-2025/","Peter Duffy (Chief Executive Officer)","500 to 999","MONY GROUP FINANCIAL LIMITED","False","2026/04/05 00:00:00","2025/11/11 13:46:54"
"MOONBUG ENTERTAINMENT LIMITED","23355","3rd Floor Labs Upper Lock, 3-6 Water Lane, London, United Kingdom, NW1 8JZ","NW1 8JZ","11197631","90030","7.7","-11.7","31","0","93.8","91","56","44","59","41","54","46","47","53","","Lumin Rose (Director, HR Operations)","250 to 499","MOONBUG ENTERTAINMENT LIMITED","False","2026/04/05 00:00:00","2025/09/17 15:43:14"
"MOONPIG GROUP PLC","21528","10 Back Hill, London, United Kingdom, EC1R 5EN","EC1R 5EN","13096622","70100","21.7","26.3","76.2","36.6","77.1","70.5","42.0","58.0","38.0","62.0","49.7","50.3","66.3","33.7","https://www.moonpig.group/media/pxkksyxn/moonpig-group-plc-fy25-gender-pay-gap-report-final-website.pdf","Nickyl Raithatha (Chief Executive Officer)","Less than 250","MOONPIG GROUP PLC","False","2026/04/05 00:00:00","2025/07/10 10:35:52"
"MOONPIG.COM LIMITED","21527","10 Back Hill, London, England, EC1R 5EN","EC1R 5EN","03852652","18129,
47910","24.7","35.1","52","36.1","82.4","70","31.6","68.4","37.9","62.1","61.7","38.3","68.1","31.9","https://www.moonpig.group/media/pxkksyxn/moonpig-group-plc-fy25-gender-pay-gap-report-final-website.pdf","Nickyl Raithatha (Chief Executive Officer)","250 to 499","MOONPIG.COM LIMITED","False","2026/04/05 00:00:00","2025/07/10 10:36:24"
"MOORCROFT GROUP PUBLIC LIMITED COMPANY","8622","Moorcroft House, No.2 Spring Gardens, Stockport, SK1 4AA","SK1 4AA","01704109","64999","15.95","2.98","","","0","0","48.5","51.5","46.39","53.61","39.8","60.2","60.2","39.8","","Amanda Martin-McRoberts (Director)","250 to 499","MOORCROFT GROUP PUBLIC LIMITED COMPANY","False","2026/04/05 00:00:00","2025/11/07 16:43:34"
"MOORES FURNITURE GROUP LIMITED","128","Thorp Arch Estate, Wetherby, LS23 7DD","LS23 7DD","01083749","31020,
31090,
43210,
43320","10.48","4.28","84.30","77.01","4.88","8.70","86.67","13.33","56.19","43.81","83.81","16.19","85.71","14.29","","Naomi Guy (Payroll and Benefits Manager)","250 to 499","MOORES FURNITURE GROUP LIMITED","False","2026/04/05 00:00:00","2025/12/18 11:54:06"
"MOORES REFRIGERATION CONTROLLED TRANSPORT LIMITED","8624","Potash Lane, Mid Suffolk Business Park, Eye, Suffolk, IP23 7HE","IP23 7HE","01190488","49410","2.6","5.6","38.7","-110","3.6","12.9","77.3","22.7","94.7","5.3","96.1","3.9","93.4","6.6","","Darren Moore (Director)","250 to 499","MOORES REFRIGERATION CONTROLLED TRANSPORT LIMITED","False","2026/04/05 00:00:00","2025/12/08 12:13:09"
"MOORVIEW CARE LIMITED","23451","107 Cleethorpe Road, Grimsby, North East Lincolnshire, DN31 3ER","DN31 3ER","04120661","96090","-7.78","-10.75","-5.62","0","62.37","69.8","35.59","64.41","46.55","53.45","33.90","66.10","24.14","75.86","","Vikki Knibbs (Head of HR & Projects)","250 to 499","MOORVIEW CARE LIMITED","False","2026/04/05 00:00:00","2025/12/12 10:52:06"
"MOSSCARE ST. VINCENT'S HOUSING GROUP LIMITED","18784","7th Floor, Trafford House, Chester Road, Stretford, M32 0RS","M32 0RS","RS007609","","1.2","-1.4","-90.80","-50","25.80","38.50","38.20","61.80","55.90","44.10","44.10","55.90","44.60","55.40","","Sian Leighton (Director of Strategy & Inclusive Culture)","250 to 499","MOSSCARE ST. VINCENT'S HOUSING GROUP LIMITED","False","2026/04/05 00:00:00","2025/11/07 09:41:02"
"MOTABILITY OPERATIONS LIMITED","8654","Level 6, 22 Bishopsgate Level 6, 22 Bishopsgate, London, England, EC2N 4BQ","EC2N 4BQ","01373876","64910","18.1","14.1","36.3","17.1","90.2","96.4","41.7","58.3","41.3","58.7","45.9","54.1","62.8","37.2","https://www.mo.co.uk/media/vuuh213i/motability-operations-pay-gap-report-2025.pdf","Andrew Miller (CEO)","1000 to 4999","MOTABILITY OPERATIONS LIMITED","False","2026/04/05 00:00:00","2025/08/27 11:06:43"
