"EmployerName","EmployerId","Address","PostCode","CompanyNumber","SicCodes","DiffMeanHourlyPercent","DiffMedianHourlyPercent","DiffMeanBonusPercent","DiffMedianBonusPercent","MaleBonusPercent","FemaleBonusPercent","MaleLowerQuartile","FemaleLowerQuartile","MaleLowerMiddleQuartile","FemaleLowerMiddleQuartile","MaleUpperMiddleQuartile","FemaleUpperMiddleQuartile","MaleTopQuartile","FemaleTopQuartile","CompanyLinkToGPGInfo","ResponsiblePerson","EmployerSize","CurrentName","SubmittedAfterTheDeadline","DueDate","DateSubmitted"
"Somerset Council","22827","County Hall The Crescent, Taunton, United Kingdom, TA1 4DY","TA1 4DY","","","3.8","6.5","","","0","0","29","71","27","73","31","69","33","67","","","1000 to 4999","Somerset Council","False","2026/03/31 00:00:00","2025/05/28 13:48:48"
"SONOCO LIMITED","11341","C/O Sonoco Cores & Paper Ltd Stainland Board Mills, Holywell Green, Halifax, England, HX4 9PY","HX4 9PY","00082196","17120","8.73","7.61","51","61.90","10.51","17.72","50.46","49.54","58.72","41.28","68.52","31.48","76.85","23.15","","Stacy Williams (Associate Director HR Europe RPC)","250 to 499","SONOCO LIMITED","False","2026/04/05 00:00:00","2025/04/16 08:00:10"
"SOUTH DOWNS LEISURE","15359","Field Place, The Boulevard, Worthing, West Sussex, BN13 1NP","BN13 1NP","09204269","93110","-5.29","-17","","","0","0","56","44","27","73","36","64","21","79","","Jill Dean (Management Accountant)","500 to 999","SOUTH DOWNS LEISURE","False","2026/04/05 00:00:00","2026/01/02 11:07:26"
"SOUTH EAST WATER LIMITED","500","South East Water Limited, Rocfort Road, Snodland, Kent, ME6 5AH","ME6 5AH","02679874","36000","18.18","20.04","75.02","24.42","20.63","52.17","36.82","63.18","60.29","39.71","71.58","28.42","77.26","22.74","https://www.southeastwater.co.uk/about/resources/publications/gender-pay-gap-report/","David Hinton (CEO)","1000 to 4999","SOUTH EAST WATER LIMITED","False","2026/04/05 00:00:00","2026/01/06 11:58:16"
"South Hampshire College Group","23542","Bishopsfield Road, Fareham, HAMPSHIRE, PO14 1NH","PO14 1NH","","","9","13","","","0","0","28","72","28","72","34","66","55","45","https://shcg.ac.uk/wp-content/uploads/SHCG-Gender-Pay-Gap_2425.pdf","","500 to 999","South Hampshire College Group","False","2026/03/31 00:00:00","2025/12/15 13:47:22"
"South Kesteven District Council","11378","Council Offices, St. Peters Hill, Grantham, Lincolnshire, United Kingdom, NG31 6PZ","NG31 6PZ","","1,
84110","-4.93","-4.08","","","0","0","69","31","44","56","53","47","55","45","","","500 to 999","South Kesteven District Council","False","2026/03/31 00:00:00","2025/12/16 15:00:24"
"South Staffordshire college","15443","Rodbaston Drive, Penkridge, Staffordshire, ST19 5PH","ST19 5PH","","1,
85310","14.61","27.07","","","0","0","16.35","83.65","26.58","73.42","46.84","53.16","44.03","55.97","","","500 to 999","South Staffordshire college","False","2026/03/31 00:00:00","2026/01/16 13:41:14"
"South Staffordshire Council","11390","Wolverhampton Road, Codsall, Wolverhampton, West Midlands, United Kingdom, WV8 1PX","WV8 1PX","","1,
84110","2.33","0.00","","","0","0","32","68","47","53","30","70","47","53","","","250 to 499","South Staffordshire Council","False","2026/03/31 00:00:00","2026/01/16 10:39:50"
"South Tees Hospitals Nhs Foundation Trust","11393","The James Cook University Hospital, Marton Road, Middlesbrough, Cleveland, United Kingdom, TS4 3BW","TS4 3BW","","1,
86210","30.44","21.14","40.76","47.93","5.37","0.27","17.36","82.64","14.60","85.40","11.35","88.65","32.22","67.78","","","5000 to 19,999","South Tees Hospitals Nhs Foundation Trust","False","2026/03/31 00:00:00","2025/07/01 08:41:04"
"SOUTH WEST LARDER LIMITED","20845","300 Thames Valley Park Drive, Reading, United Kingdom, RG6 1PT","RG6 1PT","11481919","56101","16","20","3.38","0.6","10.81","7.31","26","74","19","81","48","52","49","51","https://somersetlarder.co.uk/gender-gap-report/","Steve Braithwaite (Managing Director)","250 to 499","SOUTH WEST LARDER LIMITED","False","2026/04/05 00:00:00","2026/01/16 17:38:58"
"South Western Ambulance Service Foundation Trust","11405","Unit 1 Abbey Court, Eagle Way, Sowton Industrial Estate, Exeter, Devon, United Kingdom, EX2 7HY","EX2 7HY","","1,
86210","5.0","3.0","18.88","2.63","64.8","67.9","45.1","54.9","47.6","52.4","49.9","50.1","55.4","44.6","https://www.swast.nhs.uk/download/edi-annual-report-2025-wres-wdes-gender-race-pay-gappdf.pdf?ver=3041&doc=docm93jijm4n2950.pdf","","5000 to 19,999","South Western Ambulance Service Foundation Trust","False","2026/03/31 00:00:00","2025/09/30 12:29:38"
"Southampton City Council","11411","Civic Centre, Southampton, Hampshire, United Kingdom, SO14 7LY","SO14 7LY","","1,
84110","-1.1","0.0","","","0","0","41.6","58.4","43.7","56.3","44.9","55.1","37.9","62.1","","","1000 to 4999","Southampton City Council","False","2026/03/31 00:00:00","2025/11/05 13:34:26"
"SOUTHDOWN HOUSING ASSOCIATION LIMITED","294","2 Bell Lane, Lewes, United Kingdom, BN7 1JU","BN7 1JU","IP20755R","","5.58","0.00","0.86","0.00","77.27","77.45","33.85","66.15","33.33","66.67","30.26","69.74","37.44","62.56","https://heyzine.com/flip-book/9f280d179c.html","Jo Raisey (Chief Experience & Transformation Officer)","500 to 999","SOUTHDOWN HOUSING ASSOCIATION LIMITED","False","2026/04/05 00:00:00","2025/09/02 10:39:48"
"SOUTHERN ELECTRIC POWER DISTRIBUTION PLC","475","No.1 Forbury Place, 43 Forbury Road, Reading, United Kingdom, RG1 3JH","RG1 3JH","04094290","35130","6.16","4.7","56.82","0","34.9","36.8","70.2","29.8","79.0","21.0","76.1","23.9","80.9","19.1","https://www.sse.com/media/lifo554i/sse-sustainability-report-2025.pdf","Alistair Phillips-Davies (Chief Executive)","1000 to 4999","SOUTHERN ELECTRIC POWER DISTRIBUTION PLC","False","2026/04/05 00:00:00","2025/06/13 12:42:28"
"SOUTHERN TYRE CO LIMITED","11424","Unit 7 Hackhurst Lane, Hackhurst Industrial Estate, Lower Dicker Hailsham, East Sussex, BN27 4BR","BN27 4BR","00615334","45310,
45320","1.84","4.23","66.59","39.46","93.1","47.1","91.7","8.3","95.2","4.8","98.8","1.2","94","6","","J E L Sattin (Director)","250 to 499","SOUTHERN TYRE CO LIMITED","False","2026/04/05 00:00:00","2025/11/04 14:18:40"
"SOUTHFIELDS MULTI ACADEMY TRUST","19481","333 Merton Road, London, SW18 5JU","SW18 5JU","08190187","85310","12","31","","","0","0","20","80","18","82","25","75","31","69","","","250 to 499","SOUTHFIELDS MULTI ACADEMY TRUST","False","2026/03/31 00:00:00","2025/12/22 13:15:19"
"Southport College","11427","Mornington Road, Southport, Merseyside, PR9 0TT","PR9 0TT","","1,
85320","14","23","","","0","0","23","77","23","77","25","75","47","53","https://www.southport.ac.uk/documents/Gender%20Pay%20Reporting%202025.pdf","","250 to 499","Southport College","False","2026/03/31 00:00:00","2025/09/17 08:29:48"
"SPECIAL MELTED PRODUCTS LIMITED","1561","President Way Works, President Way, Sheffield, S4 7UR","S4 7UR","01919677","24450","-0.7","-1.51","-60.69","33.65","93","88","85","15","95","5","90","10","88.33","11.67","","Kenneth Andrew Richardson (Managing Director)","250 to 499","SPECIAL MELTED PRODUCTS LIMITED","False","2026/04/05 00:00:00","2025/05/30 08:43:11"
"SPECTRUM COMMUNITY HEALTH C.I.C.","11460","1 Navigation Walk, Wakefield, West Yorkshire, WF1 5RH","WF1 5RH","07300133","86220","27.2","16.6","-28.63","0","10.30","8.33","10.57","89.43","12.6","87.4","12.2","87.8","21.14","78.86","","Petra Bryan (Director of HR & OD)","500 to 999","SPECTRUM COMMUNITY HEALTH C.I.C.","False","2026/04/05 00:00:00","2026/01/02 09:04:01"
"SPECTRUM SERVICE SOLUTIONS LIMITED","297","1 Marchfield Drive, Westpoint Business Park, Paisley, Renfrewshire, Scotland, PA3 2RB","PA3 2RB","SC245163","81299","-3.14","0","-87.53","-58.46","1.53","2.65","42","58","34","66","42","58","37","63","","Carly Donnelly (Head of Payroll)","500 to 999","SPECTRUM SERVICE SOLUTIONS LIMITED","False","2026/04/05 00:00:00","2026/01/02 09:52:28"
"SSE AIRTRICITY ENERGY SUPPLY (NI) LIMITED","21577","Millennium House, 25 Great Victoria Street, Belfast, Northern Ireland, BT2 7AQ","BT2 7AQ","NI041956","35110","-2.46","-4.2","34.23","11.64","85.52","92.17","68.8","31.2","71.2","28.8","65","35","59.5","40.5","https://www.sse.com/media/lifo554i/sse-sustainability-report-2025.pdf","Alistair Phillips-Davies (Chief Executive)","250 to 499","SSE AIRTRICITY ENERGY SUPPLY (NI) LIMITED","False","2026/04/05 00:00:00","2025/06/13 12:43:32"
"SSE ENERGY SUPPLY LIMITED","473","No.1 Forbury Place, 43 Forbury Road, Reading, United Kingdom, RG1 3JH","RG1 3JH","03757502","35140","21.82","18.2","76.65","84.95","59.24","50.67","40.7","59.3","48.3","51.7","55.8","44.2","67.4","32.6","https://www.sse.com/media/lifo554i/sse-sustainability-report-2025.pdf","Alistair Phillips-Davies (Chief Executive)","1000 to 4999","SSE ENERGY SUPPLY LIMITED","False","2026/04/05 00:00:00","2025/06/13 12:43:59"
"SSE PLC","393","Inveralmond House, 200 Dunkeld Road, Perth, Perthshire, PH1 3AQ","PH1 3AQ","SC117119","70100","8.74","11.49","41.88","32.5","55.71","59.2","61","39","67.2","32.8","73.2","26.8","76.8","23.2","https://www.sse.com/media/lifo554i/sse-sustainability-report-2025.pdf","Alistair Phillips-Davies (Chief Executive)","5000 to 19,999","SSE PLC","False","2026/04/05 00:00:00","2025/06/13 12:44:23"
"SSE RENEWABLES SERVICES (UK) LIMITED","22352","Millennium House, 25 Great Victoria Street, Belfast, Northern Ireland, BT2 7AQ","BT2 7AQ","NI043294","35110,
82990","8.62","10.7","23.42","-2.4","82.78","83.33","69.6","30.4","70.1","29.9","78.6","21.4","81.8","18.2","https://www.sse.com/media/lifo554i/sse-sustainability-report-2025.pdf","Alistair Phillips-Davies (Chief Executive)","1000 to 4999","SSE RENEWABLES SERVICES (UK) LIMITED","False","2026/04/05 00:00:00","2025/06/13 12:44:58"
"SSE SERVICES PLC","469","No.1 Forbury Place, 43 Forbury Road, Reading, United Kingdom, RG1 3JH","RG1 3JH","02366879","82990","18.2","19.3","53.0","27.0","60.0","64.2","34.3","65.7","51.9","48.1","59.1","40.9","66.1","33.9","https://www.sse.com/media/lifo554i/sse-sustainability-report-2025.pdf","Alistair Phillips-Davies (Chief Executive)","1000 to 4999","SSE SERVICES PLC","False","2026/04/05 00:00:00","2025/06/13 12:45:21"
"SSE THERMAL ENERGY OPERATIONS LIMITED","22643","No. 1 Forbury Place, 43 Forbury Road, Reading, England, RG1 3JH","RG1 3JH","12697902","35110","15.58","27.7","37.27","31.08","64.53","55.26","64.3","35.7","62.3","37.7","84.1","15.9","81.2","18.8","https://www.sse.com/media/lifo554i/sse-sustainability-report-2025.pdf","Alistair Phillips-Davies (Chief Executive)","250 to 499","SSE THERMAL ENERGY OPERATIONS LIMITED","False","2026/04/05 00:00:00","2025/06/13 12:45:43"
"SSE UTILITY SOLUTIONS LIMITED","21576","No.1 Forbury Place, 43 Forbury Road, Reading, United Kingdom, RG1 3JH","RG1 3JH","06894120","35130,
35220,
61900","18.69","20.8","60.33","55.45","77.39","72.5","55.1","44.9","72.6","27.4","79.2","20.8","83","17.0","https://www.sse.com/media/lifo554i/sse-sustainability-report-2025.pdf","Alistair Phillips-Davies (Chief Executive)","250 to 499","SSE UTILITY SOLUTIONS LIMITED","False","2026/04/05 00:00:00","2025/06/13 12:46:08"
"ST ANDREW'S HEALTHCARE","11538","St Andrew's Healthcare, Billing Road, Northampton, England, NN1 5DG","NN1 5DG","05176998","87200","3.9","2.9","","","0","0","33","67","42","58","47","53","38","62","","Vivienne McVey (Chief Executive Officer)","1000 to 4999","ST ANDREW'S HEALTHCARE","False","2026/04/05 00:00:00","2025/12/12 09:23:28"
"St Bartholomew's School","275","Andover Road, Newbury, RG14 6JP","RG14 6JP","","1,
85310","19.2","44.2","","","0","0","47.37","52.63","20.78","79.22","27.27","72.73","11.84","88.16","https://www.stbarts.co.uk/wp-content/uploads/2025/12/Gender-Pay-Gap-310325.pdf","","250 to 499","St Bartholomew's School","False","2026/03/31 00:00:00","2025/12/09 11:56:09"
"ST CUTHBERT'S CARE","360","St Cuthbert's House, West Road, Newcastle Upon Tyne, England, NE15 7PY","NE15 7PY","01645917","87100,
87200,
87900,
88990","0.66","5.66","","","0","0","13","87","8","92","25","75","17","83","https://stcuthbertscare.org.uk/about-us/","Nicholas Gilbert (Chief Executive)","250 to 499","ST CUTHBERT'S CARE","False","2026/04/05 00:00:00","2025/10/09 10:17:11"
"ST ELIZABETH HOSPICE","11597","565 Foxhall Road, Ipswich, Suffolk, IP3 8LX","IP3 8LX","01794927","86900","0.75","-5.2","","","0","0","16","84","19","81","12","88","15","85","https://www.stelizabethhospice.org.uk/about-us/statement-of-purpose/","Marlini Finney (Chief Operating Officer)","250 to 499","ST ELIZABETH HOSPICE","False","2026/04/05 00:00:00","2026/01/06 10:17:10"
"ST MARY'S ACADEMY TRUST","11573","Unit 7 Dodworth Business Park, Dodworth, Barnsley, South Yorkshire, United Kingdom, S75 3SP","S75 3SP","07917752","85200,
85600","27.9","17.8","","","0","0","4.9","95.1","6.1","93.9","7.6","92.4","16.5","83.5","","","250 to 499","ST MARY'S ACADEMY TRUST","False","2026/03/31 00:00:00","2025/06/02 08:37:26"
"ST MARY'S SCHOOL ASCOT","15717","St Marys School Ascot, St Marys, Road, Ascot, Berkshire, SL5 9JF","SL5 9JF","01844327","85310","8.4","4.3","","","0","0","23.3","76.7","28.8","71.2","20.5","79.5","36.5","63.5","","James Jordan (Finance Bursar)","250 to 499","ST MARY'S SCHOOL ASCOT","False","2026/04/05 00:00:00","2025/11/03 16:11:42"
"St Paul's Catholic School","11583","Phoenix Drive, Leadenhall, Milton Keynes, Buckinghamshire, United Kingdom, MK6 5EN","MK6 5EN","","1,
85310","9.4","19.2","","","0","0","16.9","83.1","15.9","84.1","26.1","73.9","31.5","68.5","","","250 to 499","St Paul's Catholic School","False","2026/03/31 00:00:00","2026/01/14 07:25:23"
"St Teresa of Calcutta Multi Academy Company","23513","1157 Warwick Road, Birmingham, United Kingdom, B276RG","B276RG","","","18.46","36.31","","","0","0","15.60","84.40","22.52","77.48","29.36","70.64","34.23","65.77","https://saintteresaofcalcutta.org.uk/wp-content/uploads/2025/09/Gender-Pay-Gap-St-Teresa-Of-Calcutta-MAC-2025.pdf","","250 to 499","St Teresa of Calcutta Multi Academy Company","False","2026/03/31 00:00:00","2025/12/18 09:43:13"
"ST. JOHN AMBULANCE","11602","St John's Gate, St. John's Lane, London, England, EC1M 4DA","EC1M 4DA","03866129","86900","1.70","1.35","-40.66","16.67","28.70","17.77","41","59","44","56","47","53","47","53","https://stjohn.sharepoint.com/sites/c-news/SitePages/Gender-Pay-Gap-Report.aspx","Michelle Robertson (Payroll Team Lead)","1000 to 4999","ST. JOHN AMBULANCE","False","2026/04/05 00:00:00","2025/10/06 14:45:53"
"ST. RICHARD'S HOSPICE FOUNDATION","15588","St Richard's Hospice, Wildwood Drive, Worcester, Worcestershire, WR5 2QT","WR5 2QT","01850502","86900","8.02","-10.46","","","0","0","19.3","80.7","13.79","86.21","13.79","86.21","12.07","87.93","","Daniel Haigh (Director of Corporate Services)","Less than 250","ST. RICHARD'S HOSPICE FOUNDATION","False","2026/04/05 00:00:00","2025/11/27 14:24:14"
"Staffordshire and Stoke-on-Trent Intergrated Care Board","35685","New Beacon Building, Stafford Education and Enterprise Park, Weston Road, Stafford, Staffordshire, ST18 0BF","ST18 0BF","","","27.1","19.4","","","0","0","14.9","85.1","16.4","83.6","23.1","76.9","42.5","57.5","","","250 to 499","Staffordshire and Stoke-on-Trent Intergrated Care Board","False","2026/03/31 00:00:00","2025/04/11 15:16:24"
"Staffordshire Fire & Rescue Services","11630","Pirehill House, Pirehill, Stone, Staffordshire, ST15 0BS","ST15 0BS","","1,
84250","1.26","0","","","0","0","77","23","82","18","88","12","77","23","","","500 to 999","Staffordshire Fire & Rescue Services","False","2026/03/31 00:00:00","2025/12/08 11:47:24"
"STAPLOE EDUCATION TRUST","14578","Soham Village College Sand Street, Soham, Ely, Cambridgeshire, CB7 5AA","CB7 5AA","07534901","85100,
85200,
85310","24.40","45.4","","","0","0","14.1","85.9","3.85","96.15","20.51","79.49","37.18","62.82","https://www.staploeeducationtrust.org.uk/genderpaygapreports","","250 to 499","STAPLOE EDUCATION TRUST","False","2026/03/31 00:00:00","2025/12/11 10:58:43"
"STELRAD LIMITED","11689","69-75 Side, Newcastle Upon Tyne, Tyne And Wear, NE1 3JE","NE1 3JE","02263368","25210","2.9","-4.8","50.7","64.9","9.6","11.1","72","28","98","2","88","12","76","24","","Leigh Wilcox (Chief Financial Officer)","Less than 250","STELRAD LIMITED","False","2026/04/05 00:00:00","2025/11/20 15:50:33"
"STEP ACADEMY TRUST","11694","Gonville Road, Thornton Heath, Surrey, CR7 6DL","CR7 6DL","07612865","85200","20.69","20.85","","","0","0","9","91","9","91","24","76","24","76","","","500 to 999","STEP ACADEMY TRUST","False","2026/03/31 00:00:00","2025/12/09 12:01:43"
"STEPNELL LIMITED","11701","Lawford Road, Rugby, Warwickshire, CV21 2UU","CV21 2UU","00402934","41100","19.63","22.64","100","100","100","0","85.06","14.94","67.05","32.95","85.23","14.77","93.33","6.67","","David Crombie (Group Accountant)","250 to 499","STEPNELL LIMITED","False","2026/04/05 00:00:00","2025/04/09 11:16:54"
"STOCKPORT GRAMMAR SCHOOL","15703","Stockport Grammar School, Buxton Road, Stockport, Cheshire, SK2 7AF","SK2 7AF","06261525","85100,
85200,
85310","16.5","22.7","","","0","0","13.5","86.5","26","74","28.8","71.2","38.4","61.6","","Sharon Goodier (Head of Finance)","250 to 499","STOCKPORT GRAMMAR SCHOOL","False","2026/04/05 00:00:00","2025/12/08 09:24:24"
"Stockton-On-Tees Borough Council","18708","Municipal Buildings, Church Road, Stockton-On-Tees, Cleveland, TS18 1LD","TS18 1LD","","1,
84110","2.78","0","20.33","37.5","0.3","1.14","26.30","73.70","34.37","65.63","30.81","69.19","32.8","67.2","https://www.stockton.gov.uk/current-workforce-profile","","1000 to 4999","Stockton-On-Tees Borough Council","False","2026/03/31 00:00:00","2025/08/05 10:58:06"
"Stoke on Trent College","14873","Stoke Road, Shelton, Stoke on Trent, ST4 2DG","ST4 2DG","","1,
85310","9.7","12.68","","","0","0","25.35","74.65","30.99","69.01","45.07","54.93","49.3","50.7","","","250 to 499","Stoke on Trent College","False","2026/03/31 00:00:00","2026/01/06 10:57:17"
"STONE TECHNOLOGIES LIMITED","11738","Granite One Hundred, Acton Gate, Stafford, Staffordshire, ST18 9AA","ST18 9AA","02658501","26200","22.42","6.18","33.94","33.71","44","58","73","27","60","40","63","37","85","15","https://www.convergetp.co.uk/gender-pay-gap/","Alison Hodgens (Vice President of People Operations)","250 to 499","STONE TECHNOLOGIES LIMITED","False","2026/04/05 00:00:00","2025/06/18 07:44:07"
"STONEGATE PUB COMPANY LIMITED","15650","3 Monkspath Hall Road, Solihull, B90 4SJ","B90 4SJ","BR014816","","8.3","2.0","60.4","55.1","22","28","43","57","49","51","55","45","58","42","https://www.stonegategroup.co.uk/responsibility/","David McDowall (CEO)","5000 to 19,999","STONEGATE PUB COMPANY LIMITED","False","2026/04/05 00:00:00","2026/01/08 15:06:56"
"STONEWATER LIMITED","22860","","","IP20558R","","19.6","20.9","60.1","-2.3","10.9","14.7","25.2","74.8","25.7","74.3","34.3","65.7","48.3","51.7","https://www.stonewater.org/media/hulmt32x/stonewater-gender-pay-gap-report-2025.pdf","Jonathan Layzell (Chief Executive)","500 to 999","STONEWATER LIMITED","False","2026/04/05 00:00:00","2026/01/06 12:33:10"
"STOUR VALE ACADEMY TRUST","18538","C/O Halesowen College, Whittingham Road, Halesowen, West Midlands, England, B63 3NA","B63 3NA","07865663","85200,
85310","27.98","47.74","","","0","0","6.16","93.84","10.87","89.13","20.65","79.35","30.8","69.2","","","1000 to 4999","STOUR VALE ACADEMY TRUST","False","2026/03/31 00:00:00","2026/01/13 10:11:00"
"Stratford-On-Avon District Council","11754","Elizabeth House, Church Street, Stratford-Upon-Avon, Warwickshire, United Kingdom, CV37 6HX","CV37 6HX","","1,
84110","12.7","15.2","","","0","0","25.3","74.7","23.1","76.9","38.5","61.5","51.3","48.7","","","250 to 499","Stratford-On-Avon District Council","False","2026/03/31 00:00:00","2025/07/17 11:25:03"
"SUEZ RECYCLING AND RECOVERY UK LTD","11785","Suez House, Grenfell Road, Maidenhead, Berkshire, England, SL6 1ES","SL6 1ES","02291198","38110,
38210,
38320,
39000","-7.87","-0.88","-9.8","-12.4","63.73","83.05","82.95","17.05","86.27","13.73","87.48","12.52","79.6","20.4","https://www.suez.co.uk/en-gb/news/list-of-publications","Dr Tracey Leghorn (Chief Business Services Officer)","5000 to 19,999","SUEZ RECYCLING AND RECOVERY UK LTD","False","2026/04/05 00:00:00","2025/11/25 09:32:16"
"Summit Learning Trust","16137","Ninestiles School, Hartfield Crescent, Birmingham, United Kingdom, B27 7QG","B27 7QG","","1,
85310","17.0","21.2","","","0","0","14","86","26","74","24","76","37","63","","","500 to 999","Summit Learning Trust","False","2026/03/31 00:00:00","2025/05/08 11:55:57"
"SUN CHEMICAL LIMITED","11805","3 High View Road, South Normanton, Derbyshire, DE55 2DT","DE55 2DT","02647054","20301,
20302,
82990","10.87","5.08","39.01","25.6","30.79","30.63","78.6","21.4","82.6","17.4","81.8","18.2","100","0","","Annette Kerwin (Head oF HR, UK, Ireland And Nordics)","500 to 999","SUN CHEMICAL LIMITED","False","2026/04/05 00:00:00","2025/12/22 12:18:35"
"SUNBELT RENTALS LIMITED","1494","100 Cheapside, London, England, EC2V 6DT","EC2V 6DT","00444569","77320","-1.01","1.97","43.2","0","82","82","81","19","81","19","86","14","80","20","","Phil Parker (CEO)","1000 to 4999","SUNBELT RENTALS LIMITED","False","2026/04/05 00:00:00","2026/01/09 14:39:26"
"SURVITEC GROUP LIMITED","11841","Unit 7, Twelve Quays, Morpeth Wharf, Birkenhead, United Kingdom, CH41 1LF","CH41 1LF","00905173","32990","26.5","22.9","56.2","0","34.8","20.6","39.8","60.2","56.4","43.6","67.4","32.6","74.1","25.9","","Elaine Parker (Head of Reward)","500 to 999","SURVITEC GROUP LIMITED","False","2026/04/05 00:00:00","2026/01/15 11:43:14"
"Sussex Community NHS Foundation Trust","11847","Brighton General Hospital, Elm Grove, Brighton, BN2 3EW","BN2 3EW","","1,
86210","6.8","0.0","46.8","-5.4","0.5","0.1","15.3","84.7","17.1","82.9","13.8","86.2","18.8","81.2","https://www.sussexcommunity.nhs.uk/demo-resources/annual-equality-report-2024-2025","","5000 to 19,999","Sussex Community NHS Foundation Trust","False","2026/03/31 00:00:00","2026/01/02 09:39:51"
"SVITZER MARINE LIMITED","11857","Tees Wharf, Dockside Road, Middlesbrough, TS3 6AB","TS3 6AB","00069494","50200,
52220","23.47","35.23","17.10","18.28","26.10","76.19","83.16","16.84","83.33","16.67","92.71","7.29","96.88","3.12","","David Noakes (Director)","250 to 499","SVITZER MARINE LIMITED","False","2026/04/05 00:00:00","2025/12/18 15:20:28"
"SWANN-MORTON LIMITED","11869","Penn Works, Owlerton Green, Sheffield, South Yorkshire, England, S6 2BJ","S6 2BJ","00696744","32500","24.3","15.9","0","0","100","100","28.4","71.6","23.5","76.5","51.5","48.5","72.8","27.2","https://www.swann-morton.com/pages/gender_pay.php","Julie Hemingway (Group Human Resources Manager)","250 to 499","SWANN-MORTON LIMITED","False","2026/04/05 00:00:00","2026/01/06 17:14:02"
"Swift Academies","18512","Croft Road, Hurworth, Darlington, DL22JG","DL22JG","","1","22.79","34.91","","","0","0","16.01","83.99","22.01","77.99","25.94","74.06","25.36","74.64","","","250 to 499","Swift Academies","False","2026/03/31 00:00:00","2025/12/08 09:26:32"
"SWIFT GROUP LIMITED","11888","Dunswell Road, Cottingham, East Yorkshire, HU16 4JX","HU16 4JX","00832994","29203","-12.93","-14.28","","","0","0","76.86","23.14","93.30","6.70","87.67","12.33","87.67","12.33","https://www.swiftgroup.co.uk/media/z1wbknma/2025-gender-pay-gap.pdf","Peter Smith (Chairman)","500 to 999","SWIFT GROUP LIMITED","False","2026/04/05 00:00:00","2025/11/05 17:49:38"
"SWORD IT SOLUTIONS LIMITED","21565","Staines One, Station Approach, Staines-Upon-Thames, England, TW18 4LY","TW18 4LY","03165591","62020,
62090,
70229","6.34","12.58","64.13","0","8.03","12.56","63.08","36.92","70.23","29.77","77.69","22.31","69.47","30.53","","Olga Slamenkaite (Chief Financial Officer)","500 to 999","SWORD IT SOLUTIONS LIMITED","False","2026/04/05 00:00:00","2025/12/15 15:24:36"
"SYMPHONY LEARNING TRUST","14579","Glen Hills Primary School Featherby Drive, Glen Parva, Leicester, Leicestershire, LE2 9NY","LE2 9NY","07941899","85200","16","50.23","","","0","0","1.86","98.14","1.86","98.14","9.94","90.06","14.91","85.09","https://www.symphonylearningtrust.co.uk/user_uploads/files/SLT_Gender_Pay_Report_31st_March_2025.pdf","","500 to 999","SYMPHONY LEARNING TRUST","False","2026/03/31 00:00:00","2025/07/15 10:54:51"
"SYNERGY MULTI ACADEMY TRUST","18735","Reepham High School And College Whitwell Road, Reepham, Norwich, NR10 4JT","NR10 4JT","08198980","85200,
85310","21.6","45.2","","","0","0","13.40","86.60","15.3","84.7","24.88","75.12","30.62","69.38","","","500 to 999","SYNERGY MULTI ACADEMY TRUST","False","2026/03/31 00:00:00","2025/07/10 08:46:44"
"SYSTEMS ENGINEERING & ASSESSMENT LTD","14742","Beckington Castle, 17 Castle Corner, Beckington, Frome, BA11 6TA","BA11 6TA","02302168","30300,
30990,
84220","16.95","18.84","34.83","0","71.08","71.13","68","32","74","26","85","15","91","9","https://www.sea.co.uk","Valerie Steadman (HR Director)","250 to 499","SYSTEMS ENGINEERING & ASSESSMENT LTD","False","2026/04/05 00:00:00","2025/10/01 12:49:35"
"T. QUALITY LIMITED","15070","Ings Road, Doncaster, South Yorkshire, DN5 9TL","DN5 9TL","00437914","46380,
46390,
46760","4.9","3.5","","","0","0","77.8","22.2","73.6","26.4","83.1","16.9","81.7","18.3","https://www.saria.co.uk/about-us/gender-pay-reporting-2018/","Rebecca Rhodes (Head of HR)","250 to 499","T. QUALITY LIMITED","False","2026/04/05 00:00:00","2025/06/04 22:30:51"
"Tameside Metropolitan Borough Council","11985","Dukinfield Town Hall, King Street, SK16 4LA","SK16 4LA","","1,
84110","2.71","-3.99","","","0","0","41.63","58.37","34.41","65.59","35.11","64.89","25.98","74.02","","","1000 to 4999","Tameside Metropolitan Borough Council","False","2026/03/31 00:00:00","2025/12/08 13:54:58"
